{
  "identity": {
    "id": "EK-006",
    "slug": "apara",
    "display_name": "Aparā Ekādaśī",
    "observance_type": "ekadasi",
    "aliases": [
      "Aparā Ekadashi"
    ],
    "display": {
      "sa": "Aparā Ekādaśī",
      "es": "Aparā Ekādaśī",
      "en": "Aparā Ekadashi"
    }
  },
  "classification": {
    "masa": "Jyeṣṭha",
    "paksha": "Kṛṣṇa",
    "source": "masa_paksha",
    "masa_type": "normal_masa",
    "fasting_for": null
  },
  "presentation": {
    "title": "Aparā Ekādaśī",
    "subtitle": "Jyeṣṭha · Kṛṣṇa",
    "short_description": "Contenido en preparación. El cálculo de la observancia ya proviene del Pancanga Engine.",
    "hero_quote": ""
  },
  "content": {
    "summary": {
      "status": "pending",
      "text": "",
      "points": [
        "Resumen pendiente de estructurar desde fuentes locales aprobadas."
      ]
    },
    "history": {
      "status": "pending",
      "text": "",
      "points": [
        "Historia pendiente de estructurar desde fuentes locales aprobadas."
      ]
    },
    "scriptural_basis": [
      {
        "source": "PENDING",
        "chapter": "",
        "verses": "",
        "status": "pending",
        "summary": "Pendiente de confirmar desde fuente local aprobada."
      }
    ],
    "observance": {
      "status": "pending",
      "text": "",
      "points": [
        "Notas de observancia pendientes de estructurar; el cálculo normativo permanece en el motor."
      ]
    },
    "benefits": {
      "status": "pending",
      "text": "",
      "points": [
        "Beneficios pendientes de estructurar desde fuentes locales aprobadas."
      ]
    },
    "procedure": {
      "status": "present",
      "text": "Seguir la guía calculada por Pancanga Engine para la fecha y ubicación seleccionadas. La biblioteca de contenido no modifica la regla de cálculo.",
      "points": [
        "La decisión de ayuno, Mahādvādaśī y Parāṇa se calcula fuera de este archivo de contenido."
      ]
    },
    "parana": {
      "status": "present",
      "text": "La ventana de Parāṇa se calcula dinámicamente por Pancanga Engine para cada fecha y ubicación.",
      "points": [

      ]
    },
    "astronomy": {
      "status": "present",
      "text": "Los datos astronómicos se calculan dinámicamente por Pancanga Engine y no se almacenan en este archivo.",
      "points": [

      ]
    },
    "certification": {
      "status": "present",
      "text": "La certificación vive en los informes del proyecto. Este archivo sólo aporta contenido descriptivo asociado al ObservanceId.",
      "points": [

      ]
    }
  },
  "references": [
    {
      "source": "Observance Content Catalog Integrity Certification",
      "reference_type": "certification_report",
      "local_path": "04_Tests/Vaishnava/Observance-Content-Catalog-Integrity.md",
      "note": "Campaign 52.5 identified this content file as missing. Campaign 53.1 creates a schema-valid placeholder without inventing doctrine or history."
    },
    {
      "source": "Festival Catalog",
      "reference_type": "project_document",
      "local_path": "08_Examples/RC1-Experience/content/ekadasi/catalog.json",
      "note": "Identity and slug source for this observance content entry."
    }
  ],
  "related_observances": [

  ],
  "translations": {
    "es": {
      "title": "Aparā Ekādaśī",
      "summary": "Contenido pendiente de revisión editorial."
    },
    "en": {
      "title": "Aparā Ekadashi",
      "summary": "Content pending editorial review."
    }
  },
  "metadata": {
    "version": "1.0.0",
    "language": "es",
    "last_updated": "2026-07-22",
    "status": "draft",
    "content_source": "placeholder",
    "schema_version": "observance.schema.v1"
  },
  "id": "apara",
  "name": "Aparā Ekādaśī",
  "aliases": [
    "Aparā Ekadashi"
  ],
  "source": {
    "primary_text": "PENDING",
    "local_pdf": "PENDING",
    "pages": "PENDING",
    "note": "Contenido pendiente de estructurar desde fuentes locales aprobadas."
  },
  "calendar_context": {
    "vedic_month": "Jyeṣṭha",
    "paksha": "Kṛṣṇa",
    "vaishnava_month": "Pendiente de presentación",
    "western_period": "Variable según año y ubicación"
  },
  "story_summary": [
    "Historia pendiente de estructurar desde fuentes locales aprobadas."
  ],
  "main_teaching": "Contenido pendiente de revisión editorial.",
  "observance_notes": [
    "La observancia concreta y la ventana de Parāṇa se calculan por Pancanga Engine para cada fecha y ubicación."
  ],
  "benefits_summary": [
    "Glorias y beneficios pendientes de estructurar desde fuentes locales aprobadas."
  ],
  "rc1_scope_note": "Esta biblioteca es una capa de contenido. No modifica el cálculo de tithi, Viddhā, Mahādvādaśī ni Parāṇa.",
  "provenance": {
    "primary_sources": [

    ],
    "secondary_sources": [

    ],
    "operational_sources": [
      {
        "source": "Observance Content Catalog Integrity Certification",
        "level": "C",
        "use": "content file coverage and missing-content identification",
        "local_path": "04_Tests/Vaishnava/Observance-Content-Catalog-Integrity.md",
        "note": "This source justifies creating a schema-valid placeholder. It does not provide doctrinal or historical content."
      },
      {
        "source": "Festival Catalog",
        "level": "C",
        "use": "ObservanceId, slug, display name, and classification metadata",
        "local_path": "08_Examples/RC1-Experience/content/ekadasi/catalog.json",
        "note": "Catalog identifies content associated with resolver output; it does not calculate observances."
      }
    ],
    "technical_sources": [

    ],
    "editorial_sources": [
      {
        "source": "Campaign 53.1 placeholder generation",
        "level": "E",
        "use": "structural placeholder only",
        "local_path": "04_Tests/Vaishnava/Populate-Native-Observance-Library.md",
        "note": "No doctrine, narrative, benefits, or ritual details were generated."
      }
    ],
    "reviewed_by": null,
    "approved_by": null,
    "verification_date": null
  }
}
